{
  "catalog_version": "1.0.0",
  "assessment_phase": "Phase 23.2 Adversarial Scanner Assessment",
  "objective": "Attempt to make ECDAT fail using hostile scan inputs for defensive validation and record attack input, affected component, impact, mitigation, and permanent regression test.",
  "total_attack_scenarios": 15,
  "scenarios": [
    {
      "id": "ADV-SCAN-001",
      "name": "Zip Slip Archive Directory Traversal Attack",
      "cwe_id": "CWE-22",
      "attack_input": {
        "input_type": "Hostile ZIP Archive",
        "payload_description": "Crafted ZIP archive containing relative path traversal entries (e.g. '../../etc/cron.d/evil' and '..\\..\\windows\\system32\\calc.exe') and null byte terminations.",
        "adversarial_properties": [
          "Parent directory escape markers (../ and ..\\)",
          "Null byte injection in entry name (evil.sh\\0.txt)",
          "Absolute file paths (/etc/shadow, C:\\boot.ini)"
        ],
        "sample_artifact_or_pattern": "archive_zipslip_traversal.zip"
      },
      "affected_component": {
        "module_path": "scanners.common.archive_guard",
        "component_name": "ArchiveSecurityGuard",
        "subsystem": "Archive Ingestion & Decompression"
      },
      "impact": {
        "severity": "critical",
        "failure_mode": "Arbitrary File Overwrite & Remote Code Execution",
        "risk_description": "If unmitigated, extraction of hostile archives allows writing outside the sandboxed extraction root, overwriting critical binaries, configurations, or system cron jobs."
      },
      "mitigation": {
        "defensive_strategy": "Pre-extraction canonical path containment check using Path.resolve() and strict root boundary validation with null-byte rejection.",
        "enforcing_function_or_guard": "ArchiveSecurityGuard._validate_path_containment",
        "architectural_invariants": [
          "Zero extraction outside isolated temporary destination folder",
          "PathTraversalError raised deterministically before file handle creation",
          "Immediate abort on null byte in member name"
        ]
      },
      "regression_test": {
        "runner": "pytest",
        "test_file": "tests/redteam/test_adversarial_scanner_assessment.py",
        "test_name": "test_adv_scan_001_zip_slip_traversal_defended",
        "deterministic_assertion": "Asserts PathTraversalError is raised and zero bytes are written outside target extract directory."
      }
    },
    {
      "id": "ADV-SCAN-002",
      "name": "Decompression Bomb / Zip Bomb Denial of Service",
      "cwe_id": "CWE-409",
      "attack_input": {
        "input_type": "Compressed Archive Bomb",
        "payload_description": "Highly compressed zip bomb containing repeating zeroes with a compression ratio exceeding 1000:1 (e.g. 10 KB file expanding to > 50 GB).",
        "adversarial_properties": [
          "Excessive compression ratio (> 100:1)",
          "Gigantic uncompressed size headers (> 100 MB)",
          "Recursive / nested zip archive bombs"
        ],
        "sample_artifact_or_pattern": "archive_decompression_bomb.zip"
      },
      "affected_component": {
        "module_path": "scanners.common.archive_guard",
        "component_name": "ArchiveSecurityGuard",
        "subsystem": "Archive Ingestion & Decompression"
      },
      "impact": {
        "severity": "high",
        "failure_mode": "Uncontrolled Resource Consumption & Disk/Memory Exhaustion",
        "risk_description": "Decompression bombs rapidly exhaust available disk space and virtual memory, causing host kernel panic or denial of service to the scanning worker."
      },
      "mitigation": {
        "defensive_strategy": "Strict pre-read ratio calculation, individual member size limits (25MB), total uncompressed byte limits (100MB), and file count caps (1,000 files).",
        "enforcing_function_or_guard": "ArchiveSecurityGuard._prevalidate_zip_archive",
        "architectural_invariants": [
          "Max compression ratio capped at 100.0:1",
          "Max uncompressed bytes strictly clamped to 100 MB",
          "DecompressionBombError raised prior to disk allocation"
        ]
      },
      "regression_test": {
        "runner": "pytest",
        "test_file": "tests/redteam/test_adversarial_scanner_assessment.py",
        "test_name": "test_adv_scan_002_decompression_bomb_defended",
        "deterministic_assertion": "Asserts DecompressionBombError is raised when compression ratio or uncompressed size limits are exceeded."
      }
    },
    {
      "id": "ADV-SCAN-003",
      "name": "Billion Laughs XML Entity Expansion Bomb in CBOM/SBOM",
      "cwe_id": "CWE-611",
      "attack_input": {
        "input_type": "Adversarial XML Document",
        "payload_description": "CycloneDX XML document containing recursive exponential entity declarations (lol1 expands to 10 lol, lol2 to 10 lol1, ..., lol9 to 10 lol8) generating gigabytes in memory.",
        "adversarial_properties": [
          "Nested XML DTD entity expansion",
          "Exponential memory blowup (&lol9;)",
          "External system entity (XXE) URI injection (file:///etc/passwd)"
        ],
        "sample_artifact_or_pattern": "cbom_billion_laughs.xml"
      },
      "affected_component": {
        "module_path": "scanners.cbom_io",
        "component_name": "read_cbom_file",
        "subsystem": "CBOM XML Parser & Normalizer"
      },
      "impact": {
        "severity": "high",
        "failure_mode": "Parser Crash / Memory Blowup / Server Hang",
        "risk_description": "Unrestricted XML entity parsing triggers uncontrolled memory growth leading to process termination (OOM kill) and potential local file disclosure via XXE."
      },
      "mitigation": {
        "defensive_strategy": "Strict enforcement of defusedxml library with DTD entity resolution and external entity loading disabled at the parser layer.",
        "enforcing_function_or_guard": "defusedxml.minidom.parseString / defusedxml.ElementTree",
        "architectural_invariants": [
          "Standard xml.dom.minidom and xml.etree.ElementTree are completely forbidden",
          "Entity expansion raises DefusedXmlException and aborts safely",
          "External network/file entity loading is permanently disabled"
        ]
      },
      "regression_test": {
        "runner": "pytest",
        "test_file": "tests/redteam/test_adversarial_scanner_assessment.py",
        "test_name": "test_adv_scan_003_billion_laughs_xml_bomb_defended",
        "deterministic_assertion": "Asserts defusedxml catches entity expansion and raises DefusedXmlException without memory growth."
      }
    },
    {
      "id": "ADV-SCAN-004",
      "name": "ReDoS Catastrophic Backtracking Cryptographic Pattern",
      "cwe_id": "CWE-1333",
      "attack_input": {
        "input_type": "Adversarial Source Code File",
        "payload_description": "Crafted source code containing long repeating strings with trailing non-matching characters (e.g. 50,000 characters of 'a' followed by '!') designed to trigger polynomial or exponential backtracking.",
        "adversarial_properties": [
          "Repeated overlapping capture groups",
          "Nested quantifiers in regular expressions",
          "Long non-matching string suffixes"
        ],
        "sample_artifact_or_pattern": "adversarial_redos_trigger.py"
      },
      "affected_component": {
        "module_path": "scanners.static.regex_rules",
        "component_name": "apply_regex_rules",
        "subsystem": "Static Cryptographic Rule Matcher"
      },
      "impact": {
        "severity": "medium",
        "failure_mode": "CPU Thread Starvation & Worker Hang",
        "risk_description": "Catastrophic regex backtracking monopolizes 100% CPU on worker threads, causing scan timeouts and stalling scanner pipelines."
      },
      "mitigation": {
        "defensive_strategy": "Pre-line length truncation (MAX_LINE_LENGTH = 10,000 chars), non-backtracking regex compilation, and bounded match timeouts.",
        "enforcing_function_or_guard": "scanners.static.regex_rules.apply_regex_rules",
        "architectural_invariants": [
          "Lines longer than MAX_LINE_LENGTH are truncated or segmented before regex scanning",
          "Regex execution time is bounded and deterministic (< 100ms)",
          "Non-backtracking atomic groups and possessive patterns applied"
        ]
      },
      "regression_test": {
        "runner": "pytest",
        "test_file": "tests/redteam/test_adversarial_scanner_assessment.py",
        "test_name": "test_adv_scan_004_redos_backtracking_defended",
        "deterministic_assertion": "Asserts regex evaluation of 50,000-char repeating adversarial string completes in under 50ms."
      }
    },
    {
      "id": "ADV-SCAN-005",
      "name": "Deeply Nested CBOM/SBOM Recursion Bomb (>64 levels)",
      "cwe_id": "CWE-674",
      "attack_input": {
        "input_type": "Adversarial JSON Payload",
        "payload_description": "JSON CBOM payload with 100+ levels of recursively nested sub-components designed to exhaust call stack limits during deserialization or traversal.",
        "adversarial_properties": [
          "Recursive object nesting beyond call stack frames (> 64 levels)",
          "Deeply nested arrays of cryptographic dependencies",
          "Circular self-referential graph pointers"
        ],
        "sample_artifact_or_pattern": "deeply_nested_cbom.json"
      },
      "affected_component": {
        "module_path": "backend.src.services.cbom_validation",
        "component_name": "validateCbomStructure",
        "subsystem": "Backend CBOM Ingestion Pipeline"
      },
      "impact": {
        "severity": "high",
        "failure_mode": "Call Stack Overflow & Process Termination",
        "risk_description": "Recursive tree traversal without recursion depth limits crashes Node.js with 'RangeError: Maximum call stack size exceeded'."
      },
      "mitigation": {